{
  "candidate_id": "PUBLIC-EQUITY-RESEARCH-SANDBOX",
  "name": "Public Equity Research Sandbox",
  "status": "locked",
  "registered_experiment": false,
  "implementation_exists": false,
  "customer_decision": "not_approved",
  "markets": ["ASX", "US_LISTED_EQUITIES"],
  "research_only": true,
  "broker_access_authorized": false,
  "credential_access_authorized": false,
  "network_execution_authorized": false,
  "provider_access_authorized": false,
  "trade_execution_authorized": false,
  "investment_advice_provided": false,
  "code_import_allowed": false,
  "activation_policy": "contextual_explicit_only",
  "generic_review_behavior": "use_current_conversation_if_unambiguous_else_clarify",
  "conversation_context_only": true,
  "manual_input_only": true,
  "approved_path_required": true,
  "customer_material_local_processing_only": true,
  "customer_material_upload_authorized": false,
  "customer_material_external_transfer_authorized": false,
  "public_source_approval_required": true,
  "permitted_outputs": [
    "source evidence card",
    "research hypothesis",
    "known-unknowns record",
    "backtest design",
    "risk and invalidation criteria",
    "research-oriented analysis summary",
    "educational risk considerations",
    "human review packet"
  ],
  "prohibited_actions": [
    "broker connection",
    "broker account inspection",
    "credential or API-key access",
    "customer-material upload",
    "customer-material external transfer or synchronization",
    "market-data download or scraping",
    "third-party code import",
    "provider invocation",
    "trade recommendation",
    "order creation or submission",
    "copy trading",
    "wallet access",
    "portfolio rebalancing",
    "automatic publication"
  ],
  "source_lead_policy": "immutable_commit_and_license_review_required_before_any_separate_candidate"
}
